,,Start or Timeframe,,,End,,,,,,,,This1,This2,This3
Source,Page,Year,Month,Day,Year,Month,Day,Event,,,,,,,
Era Report 2750,10,2558,1,1,,,,Signing of the Tharkad Accords. The Lyran Commonwealth joins the Star League as its fourth member.,,,,,,,
Era Report 2750,13,2590,1,1,,,,General Lord Damien Onaga assumes com mand of the Taurian ROC.,,,,,,,
Era Report 2750,14,2600,1,1,,,,The Good Years—a period of peace and prosperity in the Star League—begin.,,,,,,,
House Book House Davion,49,2630,1,1,,,,First hyperpulse generator (HPG) comes online.,,,,,,,
Era Digest: Golden Century,8,2787,1,1,,,,First Succession War begins,,,,,,,
Era Digest: Golden Century,8,2788,1,1,,,,"In the Pentagon, the SLDF begins a series of tests to cull its warriors in an e ort to build a more balanced society",,,,,,,
Era Digest: Golden Century,9,2803,1,1,,,,Nicholas Kerensky’s Exodus forces begin grueling live-fire training on Strana Mechty,,,,,,,
Historical - Operation Klondike,103,2803,1,1,,,,Major General Kerensky institutes a series of live-fire combat tests to determine who will remain in the SLDF,,,,,,,
Historical - Fedcom Civil War,15,3058,1,1,,,,Duke Morgan Kell creates the ArcRoyal Defense Cordon,,,,,,,
"Sourcebook - The Clans, Warriors of Kerensky",33,3061,1,1,,,,"Marthe Pryde departs Clan space for the Falcon occupation zone, accompanied by a large body of troops.",,,,,,,
Field Manual - Update,17,3063,1,1,,,,Capellan Confederation: Year of the Pig,,,,,,,
Field Manual - Update,18,3064,1,1,,,,Capellan Confederation: Year of the Rat,,,,,,,
Field Manual - Update,18,3065,1,1,,,,Capellan Confederation: Year of the Ox,,,,,,,
Field Manual - Update,18,3066,1,1,,,,Capellan Confederation: Year of the Tiger,,,,,,,
Field Manual - Update,19,3067,1,1,,,,Capellan Confederation: Year of the Rabbit,,,,,,,
Jihad Plot Sourcebook - Blake Ascending,173,3068,1,1,,,,"Word of Blake naval and ground forces attack the Luthien system. Reports of Blakist support for the loyalists are unconfirmed due to a planetary blackout. Loyalist and Black Dragon forces engage the Word of Blake, sparking a three-way battle for planetary control.",,,,,,,
Jihad Plot Sourcebook - Final Reckoning,43,3068,1,1,,,,"Word of Blake naval and ground forces attack Luthien system. Reports of Blakist support for the loyalists are unconfirmed due to planetary blackout. Both loyalist and Black Dragon forces engage Word of Blake, sparking three-way battle for planetary control.",,,,,,,
Jihad Plot Sourcebook - Final Reckoning,59,3079,1,1,,,,"Warlord Minamoto orders a combined orbital and nuclear attack on the ROM headquarters in Cairo. Although collateral damage causes over a million casualties, the last major Word of Blake base on Terra collapses. Word of Blake’s Alexander Kernoff is captured, but commits suicide before he can be removed from his ruined fortress.",,,,,,,
Jihad Plot Sourcebook - Final Reckoning,60,3080,1,1,,,,"The ""false"" Thomas Marik legally assumes the name of Thomas Halas.",,,,,,,
Era Report 3145,20,3137,1,1,,,,"Theodore Kurita, heir to the Draconis Combine throne, dies trying to breach Fortress Republic.",,,,,,,
Field Manual - 3145,24,3137,1,1,,,,"Theodore Kurita, heir to the Draconis Combine throne, dies trying to breach Fortress Republic.",,,,,,,
Historical - Wars of the Republic Era,16,3137,1,1,,,,Theodore Kurita dies trying to breach Fortress Republic.,,,,,,,
Era Report 3145,22,3142,1,1,,,,Formation of Wolf Empire.,,,,,,,
Field Manual - 3145,24,3142,1,1,,,,Formation of Wolf Empire.,,,,,,,
Historical - Wars of the Republic Era,16,3142,1,1,,,,Clan Wolf declares formation of the Wolf Empire.,,,,,,,
Era Report 2750,11,2575,1,2,,,,The Pollux Proclamation is issued.,,,,,,,
House Book House Davion,49,2575,1,2,,,,First Lord Ian Cameron makes his Pollux Proclamation.,,,,,,,
Era Report 3062,24,3058,1,2,,,,"Jade Falcon Khan Elias Crichell is elected ilKhan, but Khan Vlad Ward challenges ilKhan Crichell to a Trial of Refusal and kills him. Clan Jade Wolf is renamed Wolf, and Marthe Pryde becomes Jade Falcon kaKhan.",,,,,,,
"Sourcebook - The Clans, Warriors of Kerensky",32,3058,1,2,,,,"Vlad Ward of the Jade Wolves kills the new iiKhan, Elias Crichell. Ward then announces the birth of a ""new"" Wolf Clan.",,,,,,,
Era Report 3062,26,3060,1,2,,,,"Marshal Morgan Hasek-Davion is mur dered, and General Ariana Winson of the Eridani Light Horse takes command of Task Force Serpent. Lasts until 3 January.",,,,,,,
Jihad Plot Sourcebook - Final Reckoning,57,3078,1,2,,,,"Upon hearing of the massacre on Korramabad, Coordinator Hohiro Kurita immediate dispatches the Second An Ting Legion to put down the rebellion.",,,,,,,
Jihad Plot Sourcebook - Final Reckoning,59,3079,1,2,,,,"Ghost Bear paramilitary police kill Albert Gronvold-Minami, one of the top leaders of the outlawed Motstånd movement, on Stanzach.",,,,,,,
Era Digest: Dark Age,10,3133,1,2,,,,Bankruptcy Relief Bill dies in the Senate.,,,,,,,
Historical - Wars of the Republic Era,16,3133,1,2,,,,Draconis Combine forces test the Republic’s defenses.,,,,,,,
House Book House Davion,79,3030,1,3,,,,Capture of Sarna.,,,,,,,
House Book House Davion,83,3059,1,3,,,,Archon-Prince Victor Steiner-Davion names his sister Yvonne Steiner-Davion as regent of the Federated Commonwealth.,,,,,,,
Historical - Fedcom Civil War,16,3060,1,3,,,,Marshal of the Armies Morgan Hasek-Davion assassinated while enroute to Huntress,,,,,,,
"Sourcebook - The Clans, Warriors of Kerensky",33,3060,1,3,,,,Morgan Hasek-Davion assassinated under mysterious circumstances.,,,,,,,
Era Report 3145,24,3145,1,3,,,,"Jade Falcon and Hell’s Horses land on Hesperus. After token resistance, Lyran defenders abandon the planet, leaving behind several mercenary commands.",,,,,,,
Field Manual - 3145,25,3145,1,3,,,,"Jade Falcon and Hell’s Horses land on Hesperus. After token resistance, Lyran defenders abandon the planet, leaving behind several mercenary commands.",,,,,,,
Era Report 2750,20,2743,1,4,,,,Lyran troops begin massing along the Combine border.,,,,,,,
Handbook House Steiner,37,2791,1,4,,,,Archon Jennifer Steiner killed in action on Styx.,,,,,,,
House Book House Davion,71,3014,1,4,,,,"First Prince Hanse Davion leads an attack on Halstead Station, recovering valuable Star League-era books.",,,,,,,
Historical - Fedcom Civil War,12,3040,1,4,,,,Katrina Steiner dies,,,,,,,
Era Report 3052,18,3052,1,4,,,,"The battle for Luthien begins as the smoke Jaguars and the nova Cats attack. Having been tipped off early, Kanrei Theodore kurita has the world well-prepared and has received assistance from Hanse Davion in the form of the kell Hounds and Wolf’s Dragoons mercenary units. A total of twelve frontline and three militia regiments defend the world against five Galaxies. After two days, the Inner sphere forces throw the Clan invaders off the planet.",,,,,,,
Jihad Plot Sourcebook - Final Reckoning,45,3069,1,4,,,,"Hohiro Kurita is liberated from a Blakist prison camp on Dieron, reportedly with aid from surviving elements of the Royal Black Watch.",,,,,,,
Jihad Plot Sourcebook - Jihad Hot Spots - 3072,11,3069,1,4,,,,"Hohiro Kurita is liberated from a Blakist prison camp on Dieron, reportedly with aid from surviving elements of the Royal Black Watch.",,,,,,,
Jihad Plot Sourcebook - Final Reckoning,48,3071,1,4,,,,"As part of a growing effort to contain the various border conflicts and coordinate a mutual defense strategy, Precentor Martial Victor Steiner-Davion meets with General Adam Steiner and Khan Phelan Kell of Clan Wolf (in-Exile) on Arc-Royal.",,,,,,,
Jihad Plot Sourcebook - Jihad Hot Spots - 3076,11,3071,1,4,,,,"As part of a growing effort to contain the various border conflicts and coordinate a mutual defense strategy, Precentor Martial Victor Steiner-Davion meets with General Adam Steiner and Khan Phelan Kell of Clan Wolf (in-Exile) on Arc-Royal.",,,,,,,
Era Report 3145,24,3145,1,4,,,,Wolf forces land on Hesperus.,,,,,,,
Field Manual - 3145,25,3145,1,4,,,,Wolf forces land on Hesperus.,,,,,,,
Historical - First Succession War,114,2787,1,5,,,,Draconis Combine launches massive assault across Federated Suns’ Draconis March,,,,,,,
Handbook House Marik,39,2842,1,5,,,,"Commonwealth troops land on Irian, initiating a four-month campaign to secure the heavily industrialized world. The arrival of League reinforcements in March ultimately forces the Lyran assault back and marks the start of the FWLM countero?ensive.",,,,,,,
Historical - Second Succession War,81,2842,1,5,,,,"Commonwealth troops land on Irian, initiating what will become a four-month campaign to secure the heavily industrialized world; The arrival of League reinforcements in March, however, ultimately forces the Lyran assault back",,,,,,,
Era Report 3052,18,3052,1,5,,,,"On satalice, ragnar Magnusson, the heir apparent to the throne of the Frr, is captured by Clan Wolf.",,,,,,,
Historical - Fedcom Civil War,13,3052,1,5,,,,Battle for Luthien,,,,,,,
Historical - Fedcom Civil War,13,3052,1,5,,,,Battle of Alyina in which Archon-Prince designate Victor Steiner-Davion is almost captured,,,,,,,
Historical - Fedcom Civil War,13,3052,1,5,,,,Justin Allard killed and Prime Minister Candace Liao wounded in assassination attempt ordered by Chancellor Romano Liao,,,,,,,
House Book House Davion,79,3052,1,5,,,,Battle for Luthien,,,,,,,
House Book House Davion,79,3052,1,5,,,,"Federated Suns Intelligence Minister Justin Allard is assassinated on New Avalon; his wife, Duchess Candace Liao, is thought dead as well; Duchess Liao resurfaces months later.",,,,,,,
"Sourcebook - The Clans, Warriors of Kerensky",32,3052,1,5,,,,Battle of Luthien.,,,,,,,
Era Report 3062,26,3059,1,5,,,,The Black Dragons attempt to assassinate Victor Steiner-Davion and Omi Kurita. Victor Steiner-Davion is gravely wounded but manages to kill his attackers.,,,,,,,
Jihad Plot Sourcebook - Final Reckoning,45,3069,1,5,,,,The entire Snow Raven naval Star at Ramora is sabotaged and destroyed by Blakist-backed terrorists using Combine vessels and tactics.,,,,,,,
Jihad Plot Sourcebook - Jihad Hot Spots - 3072,11,3069,1,5,,,,The entire Snow Raven naval Star at Ramora is sabotaged and destroyed by Blakist-backed terrorists using Combine vessels and tactics.,,,,,,,
Jihad Plot Sourcebook - Final Reckoning,47,3070,1,5,,,,Theodore Kurita dies. Hohiro Kurita is named Coordinator.,,,,,,,
Jihad Plot Sourcebook - Jihad Hot Spots - 3072,20,3070,1,5,,,,Theodore Kurita dies. Hohiro Kurita is named Coordinator.,,,,,,,
Jihad Plot Sourcebook - Final Reckoning,51,3074,1,5,,,,"Chandrasekhar Kurita releases his coalition force—under Lyran and Exiled Wolf Clan naval escort—to attack Odessa, suspecting the system to be the location of the secret Ruins of Gabriel. Word of Blake defense forces emerge to defend the base, which is revealed to be a moon orbiting the system’s farthest planet. Though the Blakists manage to beat back the allied troops, however, their forces nevertheless poison the world of Odessa and withdraw to scuttle their now-exposed facilities.",,,,,,,
Jihad Plot Sourcebook - Jihad Hot Spots - 3076,37,3074,1,5,,,,"Chandrasekhar Kurita releases his coalition force—under Lyran and Exiled Wolf Clan naval escort—to attack Odessa, suspecting the system to be the location of the secret Ruins of Gabriel. Word of Blake defense forces emerge to defend the base, which is revealed to be a moon orbiting the system’s farthest planet. Though the Blakists manage to beat back the allied troops, however, their forces nevertheless poison the world of Odessa and withdraw to scuttle their now-exposed facilities.",,,,,,,
Jihad Plot Sourcebook - Final Reckoning,55,3077,1,5,,,,"Belle Lee’s forces arrive on Lyons to settle the fighting between the DCMS and LAAF troops there, ultimately replacing both commands with elements of the Com Guard’s depleted Sixth Army.",,,,,,,
Jihad Plot Sourcebook - Final Reckoning,59,3079,1,5,3079,2,2,"The Regulans launch a conventional assault on Gibson to ensure the destruction of any Manei Domini survivors. Amid the hellish, post-apocalyptic wastes, several surviving Domini forces are rooted out and destroyed.",,,,,,,
Jihad Plot Sourcebook - Final Reckoning,59,3079,1,5,,,,"The Coalition captures the last of the Blakist defenders at Towra Point, effectively ending the battle for Terra.",,,,,,,
Historical - Operation Klondike,102,2788,1,6,,,,General Kerensky institutes a testing program which will result in the controlled demobilization of 75% of the SLDF,,,,,,,
Era Report 3145,23,3143,1,6,,,,"Nova Cats defeated on Kagoshima, ending their rebellion.",,,,,,,
Field Manual - 3145,24,3143,1,6,,,,"Nova Cats defeated on Kagoshima, ending their rebellion.",,,,,,,
Historical - Wars of the Republic Era,16,3143,1,6,,,,The Nova Cats’ revolution fails. They are virtually annihilated.,,,,,,,
Era Report 3145,24,3145,1,6,,,,Capellans take Taygeta.,,,,,,,
Field Manual - 3145,25,3145,1,6,,,,Capellans take Taygeta.,,,,,,,
Dark Age - Shattered Fortress,100,3149,1,6,,,,"Devlin Stone brings down the Wall of Fortress Republic. Operation SHOFAR begins, ultimately reclaiming several former Republic worlds, some without the need for violence.",,,,,,,
House Book House Davion,71,2931,1,7,,,,"First Prince Joseph Davion II abdicates and is succeeded by his son, Peter Davion.",,,,,,,
Era Report 3052,18,3052,1,7,,,,"Primus Myndo Waterly meets with ilkhan kerensky on satalice and learns that the objective of the Clan invasion is Terra. As a reaction to the problems during the early waves, khan Jorgensson of Clan Ghost bear orders a change in tactics and strategy when dealing with the Inner sphere forces. His merchants are told to find supplies wherever possible, even if it means dealing with Inner sphere merchants.",,,,,,,
Jihad Plot Sourcebook - Final Reckoning,45,3069,1,7,,,,"Lyran troops successfully reclaim Mizar, Summer and Alcor.",,,,,,,
Jihad Plot Sourcebook - Jihad Hot Spots - 3072,11,3069,1,7,,,,"Lyran troops successfully reclaim Mizar, Summer and Alcor.",,,,,,,
Jihad Plot Sourcebook - Final Reckoning,47,3070,1,7,,,,"Citing new evidence, the Capellan government declares that the Word of Blake—not the Federated Suns—were the culprits behind the bombing of Sian. In an astonishing turnaround, Chancellor Sun-Tzu Liao calls for a cease-fire with Hasek’s forces (including those still engaged at New Syrtis), and offers to unite against the common enemy.",,,,,,,
Jihad Plot Sourcebook - Jihad Hot Spots - 3072,20,3070,1,7,,,,"Citing new evidence, the Capellan government declares that the Word of Blake—not the Federated Suns—were the culprits behind the bombing of Sian. In an astonishing turnaround, Chancellor Sun-Tzu Liao calls for a cease-fire with Hasek’s forces (including those still engaged at New Syrtis), and offers to unite against the common enemy.",,,,,,,
Jihad Plot Sourcebook - Final Reckoning,51,3074,1,7,,,,"Two Divisions of Blakist forces— augmented by Kali Liao’s Warrior Houses— launch a surprise assault against Forbidden City on Sian. At the peak of the fighting, however, one of Kali’s Warrior Houses turns on the other, effectively eliminating both from the battle, turning the tide in favor of the defending CCAF forces and forcing the Word of Blake forces into a rout.",,,,,,,
Jihad Plot Sourcebook - Jihad Hot Spots - 3076,47,3074,1,7,,,,"Two Divisions of Blakist forces— augmented by Kali Liao’s Warrior Houses— launch a surprise assault against Forbidden City on Sian. At the peak of the fighting, however, one of Kali’s Warrior Houses turns on the other, effectively eliminating both from the battle, turning the tide in favor of the defending CCAF forces and forcing the Word of Blake forces into a rout.",,,,,,,
Historical - Wars of the Republic Era,15,3105,1,7,,,,The Victoria War ends.,,,,,,,
Jihad Plot Sourcebook - Final Reckoning,45,3069,1,8,3069,1,21,"Jade Falcon forces conquer Black Earth, Blackjack, Blue Hole and Roadside.",,,,,,,
Jihad Plot Sourcebook - Jihad Hot Spots - 3072,12,3069,1,8,3069,1,21,"Jade Falcon forces conquer Black Earth, Blackjack, Blue Hole and Roadside.",,,,,,,
Jihad Plot Sourcebook - Final Reckoning,52,3075,1,8,,,,"Taurian forces launch invasions against Robsart, Horsham, and Brusett. Robsart and Horsham fall quickly, but on Brusett, the newly formed Fourth Taurian Lancers encounter elements of the Hansen’s Roughriders. Despite employing nuclear weapons against the planetary capital and primary spaceport, the Fourth fails to destroy the Roughriders, and are destroyed instead by a Roughriders ambush.",,,,,,,
Jihad Plot Sourcebook - Jihad Hot Spots - Terra,13,3075,1,8,,,,"Taurian forces launch invasions against Robsart, Horsham, and Brusett. Robsart and Horsham fall quickly, but on Brusett, the newly-formed Fourth Taurian Lancers encounter elements of the Hansen’s Roughriders. Despite employing nuclear weapons against the planetary capital and primary spaceport, the Fourth fails to destroy the Roughriders, and are destroyed instead by a Roughriders ambush.",,,,,,,
Jihad Plot Sourcebook - Final Reckoning,59,3079,1,9,,,,"Cilla Amdahl, the remaining leader of the Motstånd, narrowly escapes capture on Tinaca.",,,,,,,
Historical - Fedcom Civil War,12,3030,1,10,,,,"First Prince Hanse Davion and Archon Katrina Steiner declare cease-fire, ending Fourth Succession War",,,,,,,
House Book House Davion,79,3030,1,10,,,,First Prince Hanse Davion and Archon Katrina Steiner call a cease-fre.,,,,,,,
Field Manual - Update,12,3065,1,10,,,,Clan Wolf begins its own assault into the Clan Jade Falcon OZ,,,,,,,
Jihad Plot Sourcebook - Final Reckoning,52,3075,1,10,,,,"Princess-Regent Yvonne Steiner-Davion and Tancred Sandoval-Davion return to New Avalon, re-establishing central authority on the FedSuns capital with a public display and a tour of the wreckage of Avalon City.",,,,,,,
Jihad Plot Sourcebook - Jihad Hot Spots - Terra,13,3075,1,10,,,,"Princess-Regent Yvonne Steiner-Davion and Tancred Sandoval-Davion return to New Avalon, re-establishing central authority on the FedSuns capital with a public display and a tour of the wreckage of Avalon City.",,,,,,,
Jihad Plot Sourcebook - Final Reckoning,55,3077,1,10,,,,"Operation SCOUR, a four-pronged assault into the Protectorate aimed at Terra, begins on the League front with assaults against Acubens and Wasat.",,,,,,,
Historical - Wars of the Republic Era,15,3101,1,10,,,,The Second Combine-Dominion War ends.,,,,,,,
Era Report 3145,20,3137,1,10,,,,"Clan Wolf invades former Republic worlds in anti-spinward Prefectures, including Yed Posterior, Baxter, and Corridan IV.",,,,,,,
Field Manual - 3145,24,3137,1,10,,,,"Clan Wolf invades former Republic worlds in antispinward Prefectures, including Yed Posterior, Baxter, and Corridan IV.",,,,,,,
Historical - Fedcom Civil War,12,3040,1,11,,,,First Prince Hanse Davion ends war of 3039,,,,,,,
Jihad Plot Sourcebook - Final Reckoning,49,3072,1,11,,,,"A Lyran attack force led by Archon Adam Steiner and augmented by elements of Clan Wolf (in-Exile), the Kell Hounds, Wolf’s Dragoons—and even a token Jade Falcon force—assaults and liberates Tharkad. Once Tharkad is liberated, Adam Steiner transfers the Archonship back to Peter Steiner-Davion.",,,,,,,
Jihad Plot Sourcebook - Jihad Hot Spots - 3076,20,3072,1,11,,,,"A Lyran attack force led by Archon Adam Steiner and augmented by elements of Clan Wolf (in-Exile), the Kell Hounds, Wolf’s Dragoons—and even a token Jade Falcon force—assaults and liberates Tharkad. Once Tharkad is liberated, Adam Steiner transfers the Archonship back to Peter Steiner-Davion.",,,,,,,
Jihad Plot Sourcebook - Final Reckoning,50,3073,1,11,,,,The Word of Blake reclaims the capital of New Home.,,,,,,,
Jihad Plot Sourcebook - Jihad Hot Spots - 3076,25,3073,1,11,,,,The Word of Blake reclaims the capital of New Home.,,,,,,,
Era Report 2750,13,2588,1,12,,,,Battle for New Vandenburg begins with a forty-day orbital bombardment supported by incendiary bombing attacks by SLEF aerospace fighters.,,,,,,,
Era Report 2750,17,2700,1,12,,,,"The 2700 Grand Survey reveals more than 1,000 new planets have been colonized since 2632. The Era of Rapid Expansion and Colonization ends.",,,,,,,
House Book House Davion,79,3029,1,12,,,,The Northwind Highlanders reclaim their homeworld for the Federated Suns.,,,,,,,
Era Report 3052,17,3051,1,12,,,,"Called by the Dragoons, a council of war is held on outreach. Jaime Wolf releases massive amounts of information about the Clans to the Inner sphere. The leaders of the Inner sphere decide to work together to fight this external foe.",,,,,,,
Handbook House Marik,55,3051,1,12,,,,"Jaime Wolf convenes a conference of Successor State leaders on Outreach, intending to unite them against the Clans. Prince Hanse Davion blackmails Thomas Marik into providing material aid for the war e?ort. [29 October] The Clans resume their attack on the Inner Sphere.",,,,,,,
Historical - Fedcom Civil War,13,3051,1,12,,,,The leaders of the Inner Sphere convene on Outreach at the invitation of Colonel Jaime Wolf,,,,,,,
House Book House Davion,79,3051,1,12,,,,Leaders of the Inner Sphere convene on Outreach.,,,,,,,
Field Manual - Update,12,3065,1,12,,,,"Robert Kelswa-Steiner marries his fiancé of two years, Hermione Aten of Skye",,,,,,,
Jihad Plot Sourcebook - Final Reckoning,60,3081,1,12,,,,"Princess-Regent Yvonne Steiner-Davion announces the ceding of several additional FedSuns worlds to the Republic of the Sphere for an additional buffer zone. Similar declarations in the coming days acknowledge similar deals to incorporate former Lyran, Combine, and Free Worlds League planets into the Republic.",,,,,,,
Era Report 3145,24,3145,1,12,,,,Capellans launch assault on New Syrtis.,,,,,,,
Field Manual - 3145,25,3145,1,12,,,,Capellans launch assault on New Syrtis.,,,,,,,
Historical - Wars of the Republic Era,16,3145,1,12,,,,The Capellan Confederation assaults New Syrtis.,,,,,,,
Era Report 3062,13,3055,1,13,,,,"A Star of the Third Jaguar Cavaliers is killed when their barracks is blown up by the Kat Killer 5 group. In retaliation, the Smoke Jaguars annihilate the town of Kimota on Hyner. The Kat Killers will be killed in February.",,,,,,,
Jihad Plot Sourcebook - Final Reckoning,48,3071,1,13,,,,"Clan Jade Falcon attacks Great X, but the fortified world quickly becomes a quagmire.",,,,,,,
Jihad Plot Sourcebook - Jihad Hot Spots - 3076,11,3071,1,13,,,,"Clan Jade Falcon attacks Great X, but the fortified world quickly becomes a quagmire.",,,,,,,
Jihad Plot Sourcebook - Final Reckoning,49,3072,1,14,3072,1,31,"Clan Wolf pushes the Hell’s Horses off Planting, Mozirje, Feltre, and Unzmarkt before accepting cease-fire terms from the Horses’ Khan. Meanwhile, Clan Ice Hellion loses Persistence, Winfield, and Romulus to the Falcons. Also on this date, the Combine Warship Siriwan is destroyed by nuclear weapons over Algedi after issuing a final ultimatum to the Azami from Kanrei Minamoto and bombarding two Azami cities.",,,,,,,
Jihad Plot Sourcebook - Jihad Hot Spots - 3076,20,3072,1,14,3072,1,31,"Clan Wolf pushes the Hell’s Horses off Planting, Mozirje, Feltre, and Unzmarkt before accepting cease-fire terms from the Horses’ Khan. Meanwhile, Clan Ice Hellion loses Persistence, Winfield, and Romulus to the Falcons. Also on this date, the Combine Warship Siriwan is destroyed by nuclear weapons over Algedi after issuing a final ultimatum to the Azami from Kanrei Minamoto and bombarding two Azami cities.",,,,,,,
Jihad Plot Sourcebook - Final Reckoning,54,3076,1,14,,,,"In connection with the November bombing of the Association Council, Captain Alicia Carmichael of the NAM is arrested and charged with treason against the Niops Association.",,,,,,,
Jihad Plot Sourcebook - Jihad Hot Spots - Terra,19,3076,1,14,,,,"In connection with the November bombing of the Association Council, Captain Alicia Carmichael of the NAM is arrested and charged with treason against the Niops Association.",,,,,,,
Era Digest: Dark Age,10,3133,1,14,,,,Bannson’s Raiders raid New Rhodes III and force the Swordsworn to retreat.,,,,,,,
Era Report 2750,17,2703,1,15,,,,Elise Marik succeeds Gerald Marik as the Free Worlds League’s Council Lord. She deems Gerald’s death suspicious and demands a full investigation. This begins a twenty-five year effort to purge subversive elements.,,,,,,,
Historical - Operation Klondike,101,2767,1,15,,,,Stefan Amaris declares himself First Lord of the Star League in a communiqué to the Star League Council,,,,,,,
Historical - Liberation of Terra II,124,2779,1,15,,,,Invasion of North America across the Bering Straits,,,,,,,
Era Report 3052,13,3050,1,15,,,,"While on board the Dire Wolf, Anastasius Focht and Phelan kell—now bondsman of the Wolves—meet.",,,,,,,
Era Report 3062,27,3062,1,15,,,,"The Steel Vipers arrive back in Clan space, and immediately begin a campaign to consolidate their holdings there. Many of the Homeworld Clans eye their return warily.",,,,,,,
Jihad Plot Sourcebook - Final Reckoning,47,3070,1,15,3070,1,30,"As Wolf Clan troops cut deeper into Lyran space—claiming Borghese, Ft. Loudon, Kelenfold and Tomans—the Jade Falcon incursion angles toward Arc-Royal.",,,,,,,
Jihad Plot Sourcebook - Jihad Hot Spots - 3072,20,3070,1,15,3070,1,30,"As Wolf Clan troops cut deeper into Lyran space— claiming Borghese, Ft. Louden, Kelenfold and Tomans—the Jade Falcon incursion angles toward Arc-Royal.",,,,,,,
Jihad Plot Sourcebook - Final Reckoning,57,3078,1,15,,,,Duchess Therese Brett-Marik demands that Archon Adam Steiner intervene in the ongoing hostilities between Buena Archonette and the worlds near the Duchy of Tamarind. The crisis is now being cited as a key reason that Tamarind forces have not contributed to the Coalition.,,,,,,,
Jihad Plot Sourcebook - Final Reckoning,60,3081,1,15,,,,"Thomas and Sherryl Halas announce the engagement of their daughter Jessica to Philip Hughes, scion of the Irian Hughes family.",,,,,,,
Era Report 3145,19,3136,1,15,,,,Republic Standing Guard units hold Poznan against Capellan attack.,,,,,,,
