,,Start or Timeframe,,,End,,,,,,,,This1,This2,This3
Jihad Plot Sourcebook - Jihad Hot Spots - Terra,21,3076,9,17,,,,"The TCS Vendetta and her task force return to Brusett, and begin to besiege the planet.",,,,,,,
Unit Book - Wolf's Dragoons,40,3028,9,18,,,,5th Galedon Regulars dropped 100km east of main Wolf's Dragoons Alpha regiment position on Glenmora.  Alpha eventually withdrew to Crossing.  ,,,,,,,
Era Report 3062,15,3057,9,18,,,,"In response to Operation Guerrero, Katherine Steiner-Davion declares the formation of the Lyran Alliance. She invites any traditionally Lyran regiments to return to the Lyran districts and declares neutrality in the conflict between the Guerrero combatants.",,,,,,,
Historical - Fedcom Civil War,14,3057,9,18,,,,Lyran Alliance secedes from the Federated Commonwealth; Katherine Steiner-Davion named Archon by the Estates General,,,,,,,
House Book House Davion,83,3057,9,18,,,,Katherine Steiner-Davion declares herself Archon and secedes the Lyran Alliance from the Federated Commonwealth.,,,,,,,
"Sourcebook - The Clans, Warriors of Kerensky",32,3057,9,18,,,,The Lyran sector of the FedCom secedes to form the Lyran Alliance.,,,,,,,
Jihad Plot Sourcebook - Final Reckoning,56,3077,9,18,,,,"Kirc Cameron-Jones dies. An autopsy reveals poison, believed to be the work of Blakist agents.",,,,,,,
Historical - Second Succession War,80,2830,9,19,,,,Archon Marcus Steiner declares war on the Free Worlds League,,,,,,,
Field Manual - Update,7,3058,9,19,,,,The Sirian Lancers and Fourth Free Worlds Legionnaires liberate the worlds of Procyon and Sirius,,,,,,,
Jihad Plot Sourcebook - Final Reckoning,46,3069,9,19,3069,9,25,"Clan Snow Raven and Outworlds Alliance forces lay siege to Dante, allegedly after confirming reports linking local terrorists to the Word of Blake. This heavy-handed act inflames secessionist sentiments noticeably on worlds like Baliggora and Raldamax, creating a political crisis for the Avellars.",,,,,,,
Jihad Plot Sourcebook - Jihad Hot Spots - 3072,18,3069,9,19,3069,9,25,"Clan Snow Raven and Outworlds Alliance forces lay siege to Dante, allegedly after confirming reports linking local terrorists to the Word of Blake. This heavyhanded act inflames secessionist sentiments noticeably on worlds like Baliggora and Raldamax, creating a political crisis for the Avellars.",,,,,,,
Era Report 3145,18,3135,9,19,,,,Harrison Davion dies. Caleb Davion becomes First Prince.,,,,,,,
Field Manual - 3145,23,3135,9,19,,,,Harrison Davion dies. Caleb Davion becomes First Prince.,,,,,,,
Era Report 3145,24,3144,9,19,,,,Loki agents in the Jade Falcon OZ get word to Tharkad of Malvina’s plans to invade Hesperus II. Trillian Steiner leaks the info to Clan Wolf.,,,,,,,
Era Report 3062,15,3057,9,20,,,,"All of the Confederation’s Warrior House regiments combine to liberate Liao, ancestral home world of the Capellan dynasty.",,,,,,,
Jihad Plot Sourcebook - Blake Ascending,177,3068,9,20,,,,"FWLM troops take Alcor, Denebola, Mizar and Summer. Capellan and Hasek-sympathetic troops clash throughout the St. Ives region.",,,,,,,
Jihad Plot Sourcebook - Final Reckoning,45,3068,9,20,,,,"FWLM troops take Alcor, Denebola, Mizar, and Summer. Capellan and Hasek-sympathetic troops clash throughout the St. Ives region.",,,,,,,
Jihad Plot Sourcebook - Final Reckoning,58,3078,9,20,3078,10,28,"General Lee’s advance through the tunnel and mountain approaches into Sydney—and the Sekkaris fortress complex nearby—is gradual, due to heavy Word of Blake aerospace support. Likewise, Minamoto’s advance on Cairo grinds down to a series of sporadic skirmishes.",,,,,,,
Jihad Plot Sourcebook - Final Reckoning,51,3073,9,21,,,,"At the urgings of his son, Titus, Kirc Cameron-Jones abdicates his throne. Titus Cameron-Jones becomes the new Prince (and Captain-General) of Regulus.",,,,,,,
Jihad Plot Sourcebook - Jihad Hot Spots - 3076,33,3073,9,21,,,,"At the urgings of his son, Titus, Kirc Cameron-Jones abdicates his throne to the Principality of Regulus. Titus Cameron-Jones becomes the new Prince (and Captain-General) of Regulus.",,,,,,,
Jihad Plot Sourcebook - Final Reckoning,53,3075,9,21,,,,The Ghost Bears agree to assist Devlin Stone’s growing allied coalition.,,,,,,,
Jihad Plot Sourcebook - Jihad Hot Spots - Terra,17,3075,9,21,,,,The Ghost Bears agree to assist Devlin Stone’s growing allied coalition.,,,,,,,
Era Report 2750,14,2596,9,22,,,,Taurian Protector Marantha Calderon broadcasts the Concordat’s surrender throughout the Hyades Cluster. She commits suicide the next day. Her ashes are spread among the stars in the cluster.,,,,,,,
House Book House Davion,49,2596,9,22,,,,End of Taurian campaign; end of Reunifcation War.,,,,,,,
Era Report 2750,19,2738,9,22,,,,Rebecca Fetladral resigns her post as Commanding General of the SLDF. Aleksandr Kerensky succeeds her.,,,,,,,
"Sourcebook - The Clans, Warriors of Kerensky",33,3060,9,22,,,,Forces of the St. lves Compact attempt to capture or kill Sun-Tzu Liao on Hustaing. They are defeated by House Hiritsu.,,,,,,,
Jihad Plot Sourcebook - Final Reckoning,56,3077,9,22,,,,"Due to faulty intelligence, the Coalition battle for Chara becomes a bloodbath, savaging the Exiled Wolf Clan forces tasked with liberating the Protectorate world. The Wolves’ defeat includes the loss of three allied Warships to the system’s SDS network. On Regulus, Prince Titus Cameron-Jones once again renews his claim for the Captain-Generalcy, while Regulan forces simultaneously attack the Marik Commonwealth planets of Fortuna, Newcastle, and Norfolk with nuclear weapons.",,,,,,,
Jihad Plot Sourcebook - Final Reckoning,59,3079,9,22,,,,"Pro-Capellan agents detonate a series of car bombs at a pro-Stone rally on Tikonov, killing nearly 200 people. The violence—possibly aimed at Melissa Allard-Liao, a pro-Stone activist and daughter of Kai Allard-Liao—shifts public sympathies on Tikonov sharply against the Confederation.",,,,,,,
Era Report 3145,19,3135,9,22,,,,Republic begins broadcasting warnings about crossing the borders of Prefecture X.,,,,,,,
Field Manual - 3145,23,3135,9,22,,,,Republic begins broadcasting warnings about crossing the borders of Prefecture X.,,,,,,,
Jihad Plot Sourcebook - Final Reckoning,53,3075,9,23,,,,"Unknown raiders (once more rumored to be Shadow Divisions) attack the WoBM and Protectorate Militia forces on Castor, Graham IV, and Pollux.",,,,,,,
Jihad Plot Sourcebook - Jihad Hot Spots - Terra,17,3075,9,23,,,,"Unknown raiders (once more rumored to be Shadow Divisions) attack the WoBM and Protectorate Militia forces on Castor, Graham IV, and Pollux.",,,,,,,
Era Digest: Dark Age,10,3132,9,23,,,,"Dragon’s Fury forces strike at Tahlwynn on Dieron. A month long battle between the Fury, Steiner loyalists, local revolutionaries, and RAF and Sea Fox forces ends with the Republic retaining control.",,,,,,,
Field Manual - 3145,23,3132,9,23,,,,"Dragon’s Fury forces strike at Tahlwynn on Dieron. A month-long battle between the Fury, Steiner loyalists, local revolutionaries, and RAF and Sea Fox forces ends with the Republic retaining control.",,,,,,,
Era Digest: Dark Age,10,3133,9,23,,,,Republic ofcials release reports of Capellan troops massing on the border.,,,,,,,
Field Manual - 3145,23,3133,9,23,,,,Republic officials release reports of Capellan troops massing on the border.,,,,,,,
Historical - Wars of the Republic Era,16,3133,9,23,,,,House Liao begins building up forces along the Republic border.,,,,,,,
Era Report 3145,21,3139,9,23,,,,Thaddeus Marik killed in battle with Alaric Wolf.,,,,,,,
Field Manual - 3145,24,3139,9,23,,,,Thaddeus Marik killed in battle with Alaric Wolf.,,,,,,,
House Book House Davion,55,2821,9,24,,,,Ceasefre between the Federated Suns and Capellan Confederation negotiated. End of the First Succession War.,,,,,,,
Era Report 3062,15,3057,9,24,,,,"Khan Natasha Kerensky’s Clan Wolf splits into three main assault forces and invades the Jade Falcon Occupation Zone. Each of the Wolf Khans would lead one front, with former ilKhan Ulric Kerensky, now a Star Colonel, leading the third.",,,,,,,
Field Manual - Update,8,3060,9,26,,,,The St. Ives Compact’s Blackwind Lancers go rogue and assault the Confederation world of Hustaing; the attack is put down by 12 November,,,,,,,
Era Report 3052,13,3048,9,27,,,,The Outbound Light—belonging to Comstar’s Explorer Corps—jumps into the Huntress system. The crew is captured by Clan smoke Jaguar and interrogated by khan leo showers. He uses this incident to reopen the Great Debate of whether Clans should invade the Inner sphere.,,,,,,,
"Sourcebook - The Clans, Warriors of Kerensky",32,3048,9,27,,,,Clan Smoke Jaguar captures the Explorer Corps vessel Outbound Light in the Huntress system.,,,,,,,
Jihad Plot Sourcebook - Final Reckoning,46,3069,9,27,,,,"ComStar forces mustering on Summer are on hand along with local Lyran defenders when a Blakist task force of ""Pocket Warships"" and fighters attacks the planet. In the ensuing battle, a powerful thermonuclear device launched by a ""Pocket Warship"" levels the planetary capital of Curitiba and decimates the on-planet defenders. Curiously, the Blakist forces then move on, leaving no occupation troops behind.",,,,,,,
Jihad Plot Sourcebook - Jihad Hot Spots - 3072,18,3069,9,27,,,,"ComStar forces mustering on Summer are on hand along with local Lyran defenders when a Blakist task force of “Pocket Warships” and fighters attacks the planet. In the ensuing battle, a powerful thermonuclear device launched by a “Pocket Warship” levels the planetary capital of Curitiba and decimates the on-planet defenders. Curiously, the Blakist forces then move on, leaving no occupation troops behind.",,,,,,,
Jihad Plot Sourcebook - Final Reckoning,49,3071,9,27,,,,"After years trapped on Tharkad, Peter Steiner-Davion abdicates his authority as Archon of the Lyran Alliance to Adam Steiner, his General of the Armies.",,,,,,,
Jihad Plot Sourcebook - Jihad Hot Spots - 3076,16,3071,9,27,,,,"After years trapped on Tharkad, Peter Steiner-Davion abdicates his authority as Archon of the Lyran Alliance to Adam Steiner, his General of the Armies.",,,,,,,
Jihad Plot Sourcebook - Final Reckoning,52,3074,9,27,,,,"While departing New Avalon, the Word of Blake’s Forty-fourth Shadow Division detonates high explosive charges that partially collapse Mount Davion and seal up the entrances to the Fox’s Den.",,,,,,,
Jihad Plot Sourcebook - Jihad Hot Spots - 3076,54,3074,9,27,,,,"While departing New Avalon, the Word of Blake’s Forty-fourth Shadow Division detonates high explosive charges that partially collapse Mount Davion and seal up the entrances to the Fox’s Den.",,,,,,,
Era Digest: Dark Age,10,3134,9,27,,,,Marik-Stewart Commonwealth forces fail to take Stewart.,,,,,,,
Field Manual - 3145,23,3134,9,27,,,,Marik-Stewart Commonwealth forces fail to take Stewart.,,,,,,,
Era Report 3145,19,3136,9,27,,,,"Spirit Cat forces invade Marik, delivered by a Sea Fox vessel.",,,,,,,
Field Manual - 3145,23,3136,9,27,,,,"Spirit Cat forces invade Marik, delivered by a Sea Fox vessel.",,,,,,,
Era Report 2750,17,2715,9,28,,,,"Mary Davion-Kurita dies. The Draconis Combine insists that Mary’s eldest son, Vincent Kurita, be named First Prince of the Federated Suns.",,,,,,,
Historical - Operation Klondike,102,2785,9,28,,,,"The Prinz Eugen is captured, ending the revolt",,,,,,,
Jihad Plot Sourcebook - Blake Ascending,177,3068,9,28,,,,"League forces assault Khon Kaen, Penobscot and Cavanaugh II, driving back Lyran forces.",,,,,,,
Jihad Plot Sourcebook - Final Reckoning,45,3068,9,28,,,,"League forces assault Khon Kaen, Penobscot and Cavanaugh II, driving back Lyran forces.",,,,,,,
Historical - Liberation of Terra II,124,2779,9,29,,,,Stefan Amaris captured,,,,,,,
Historical - Operation Klondike,101,2779,9,29,,,,Stefan Amaris surrenders and orders his remaining forces to stand down; Terra is liberated,,,,,,,
House Book - Star League,93,2779,9,29,,,,General Kerensky with the 328th Royal Mech Division and General DeChavilier with the 26th Royal Mech Division took Imperial Palace as Amaris surrendered.,,,,,,,
Era Digest: Golden Century,8,2779,9,30,,,,Stefan Amaris executed,,,,,,,
House Book House Davion,49,2779,9,30,,,,Liberation of Terra; end of Amaris Civil War.,,,,,,,
"Sourcebook - The Clans, Warriors of Kerensky",30,2779,9,30,,,,Amaris executed.,,,,,,,
Jihad Plot Sourcebook - Final Reckoning,51,3073,9,30,,,,"The Word of Blake’s Fifty-second Shadow Division attacks Caledonia, destroying the Twenty-second Skye Rangers.",,,,,,,
Jihad Plot Sourcebook - Jihad Hot Spots - 3076,33,3073,9,30,,,,"The Word of Blake’s Fiftysecond Shadow Division attacks Caledonia, destroying the Twenty-second Skye Rangers.",,,,,,,
Jihad Plot Sourcebook - Final Reckoning,57,3077,9,30,,,,"At Nanking, a FedSuns-led Coalition force arrives to liberate the planet at the same time as the CCAF. Unable to coordinate, both commands proceed to fight the Blakist defenders, then turn on each other after the Word falls. When the mauled Confederation troops resort to the use of tactical WMDs, the allied units withdraw.",,,,,,,
Jihad Plot Sourcebook - Final Reckoning,58,3078,9,30,,,,Word of Blake forces outside of Bratislava surrender after a horrific night battle with Coalition troops.,,,,,,,
Era Report 3145,19,3135,9,30,,,,"Malvina Hazen declares herself Khan of Clan Jade Falcon, sparking a civil war.",,,,,,,
Field Manual - 3145,23,3135,9,30,,,,"Malvina Hazen declares herself Khan of Clan Jade Falcon, sparking a civil war.",,,,,,,
Era Report 3145,25,3145,9,30,,,,Lyons falls to Jade Falcons.,,,,,,,
Field Manual - 3145,25,3145,9,30,,,,Lyons falls to Jade Falcons.,,,,,,,
Era Report 2750,11,2577,9,,,,,"The Taurian Concordat launches Case AMBER, a stunning success. Nearly seventy-five percent of the Davion fleet is lost, crippled, or captured; the Taurians lose three Warships. Lasted through October.",,,,,,,
House Book House Davion,49,2596,9,,,,,End of Rim Worlds campaign.,,,,,,,
Handbook House Steiner,37,2785,9,,,,,Draconis Combine attacks Gram and Trolloc Prime. Both worlds fall within three months.,,,,,,,
Historical - First Succession War,114,2785,9,,2785,11,,Draconis Combine conquers Gram and Trolloc Prime,,,,,,,
Historical - First Succession War,114,2785,9,,,,,"Towne Debacle, Draconis Combine conquers Towne",,,,,,,
House Book House Davion,55,2785,9,,,,,"The Combine mounts a major assault upon Towne, taking the world and setting up the Towne Debacle.",,,,,,,
Handbook House Steiner,37,2789,9,,2789,12,,"During the fnal annexations of Terran Hegemony planets, LCAF forces clash with AFFS troops over Thorin, New Earth and Rocky. The worst of the fghting, centered on Rocky, leaves that world uninhabitable.",,,,,,,
Historical - First Succession War,114,2789,9,,2789,12,,"LCAF forces repel AFFS incursions on Thorin, New Earth, and Rocky",,,,,,,
House Book House Davion,55,2789,9,,,,,AFFS units infltrate the Commonwealth’s Terran Corridor and attempt to capture much-needed supplies and resources; the LCAF puts a quick end to the incursion.,,,,,,,
Historical - First Succession War,115,2795,9,,2795,11,,"LCAF captures Loburg, raids Kamenz and Tylarzka",,,,,,,
Historical - First Succession War,115,2800,9,,2800,10,,"DCMS invades Rio, but is defeated by CCAF forces",,,,,,,
Era Digest: Golden Century,8,2801,9,,,,,Nicholas Kerensky begins gathering a core of loyalists for a second Exodus,,,,,,,
Era Digest: Golden Century,9,2820,9,,,,,"The first ""trueborn"" Clansmen are decanted on Strana Mechty",,,,,,,
Historical - Second Succession War,80,2830,9,,,,,"Commonwealth troops attack Dieudonné, but are repulsed within two months",,,,,,,
House Book House Davion,71,2872,9,,,,,"AFFS captures Colia, discovering the DCMS’ logistical problems.",,,,,,,
"Sourcebook - The Clans, Warriors of Kerensky",31,2985,9,,,,,"After numerous Trials of Refusal, Clan Sea Fox becomes Diamond Shark.",,,,,,,
Historical - Brush Wars,18,3002,9,,,,,"In the second phase of his campaign, Janos Marik orders an attack on Solaris VII.",,,,,,,
Unit Book - Wolf's Dragoons,47,3021,9,,,,,"Alpha, Beta, and Epsilon Regiments take part in the attack on Dromini VI, where they meet some of Kurita's elite Sword of Light. It is here that Minobu Tetsuhara first spares Jaime Wolf's life in accord with the precepts of his Bushido code.",,,,,,,
Unit Book - Wolf's Dragoons,47,3026,9,,,,,"A group of BattleMechs disguised as Black Widows are filmed sacking a city on ""New Mendham"". Samsonov accuses the Dragoons of atrocities on Kawabe.",,,,,,,
Unit Book - Wolf's Dragoons,47,3029,9,,,,,Kurita forces invade Crossing. They are defeated by Wolfs Dragoons.,,,,,,,
Historical - Fedcom Civil War,12,3031,9,,,,,Tikonov Free Republic absorbed by the Lyran Commonwealth's Sarna March,,,,,,,
Era Report 3062,15,3057,9,,,,,"Demi-Precentor Michelle Ellingham, a secret Word of Blake agent, succeeds Damien Constantine as head of ComStar ROM’s Counterintelligence Division. This is one of many such subornings of ComStar intelligence services as the Word of Blake begins to assert its authority.",,,,,,,
Era Report 3062,15,3057,9,,,,,"In response to unrest amongst the Highlanders, the First New Avalon Institute of Science Cadet Cadre assaults Northwind. Combat between the Highlanders and the Federated Commonwealth authorities erupts, assisted by the presence of a Capellan Death Commando on-world. Northwind will eventually declare its independence from the Federated Commonwealth. Lasts until October.",,,,,,,
"Sourcebook - The Clans, Warriors of Kerensky",32,3057,9,,3057,12,,"The death of Joshua Marik prompts war between the Federated Commonwealth, Capellan Confederation and Free Worlds League.",,,,,,,
Era Report 3062,26,3060,9,,,,,"A battalion of the Blackwind Lancers, without orders, strikes Hustaing while Chancellor Liao is expected to be present. He is not, although his fiancée, Isis Marik, is briefly thought captured. The Confederation will use this attack as a pretext to begin the conflict that will ultimately reclaim the St. Ives worlds. Last until October.",,,,,,,
Era Report 3062,27,3062,9,,,,,"A cease fire in Capellan Confederation St. Ives Compact war is declared, after Capellan forces capture St. Ives itself.",,,,,,,
Jihad Plot Sourcebook - Final Reckoning,49,3071,9,,,,,Clan Jade Falcon reclaims Erewhon from Clan Ice Hellion.,,,,,,,
Jihad Plot Sourcebook - Jihad Hot Spots - 3076,16,3071,9,,,,,Clan Jade Falcon reclaims Erewhon from Clan Ice Hellion.,,,,,,,
Historical - Wars of the Republic Era,15,3122,9,,3122,11,,The Senate Alliance begins its covert attempt to reshape the Republic by sponsoring like-minded cadets at several academies.,,,,,,,
Era Digest: Dark Age,10,3132,9,,,,,Economic recovery on Vega fails.,,,,,,,
Historical - Wars of the Republic Era,16,3136,9,,,,,"Malvina Hazen challenges Khan Jana Pryde for control of Clan Jade Falcon, ultimately sparking a civil war.",,,,,,,
Era Report 3145,22,3142,9,,,,,"Free Worlds League annexes Senate Alliance, which is renamed the Augustine Alliance. [Sep-Oct] LCAF withdraws from Free Worlds League and Wolf Empire borders to reinforce worlds around Tharkad.",,,,,,,
Field Manual - 3145,24,3142,9,,3142,10,,September to October. LCAF withdraws from Free Worlds League and Wolf Empire borders to reinforce worlds around Tharkad.,,,,,,,
Field Manual - 3145,24,3142,9,,,,,"Free Worlds League annexes Senate Alliance, which is renamed the Augustine Alliance.",,,,,,,
Dark Age - Shattered Fortress,99,3146,9,,,,,Arc-Royal falls to the Jade Falcons. Grand Duke Martin Kell is killed and the Kell Hounds forces on-planet are routed. Clan Wolf-in-Exile forces abandon the planet and relocate to Donegal.,,,,,,,
Dark Age - Shattered Fortress,99,3146,9,,,,,"Binyang, Revivim, Inchicore, Danxian, Maisons, and Ellijay join Widmer’s Buena Collective.",,,,,,,
Dark Age - Shattered Fortress,99,3146,9,,,,,Daoshen formally accepts the terms of Danai’s negotiated ceasefire.,,,,,,,
Dark Age - Shattered Fortress,100,3148,9,,,,,Rumors that ComStar has refused to fix the HPG on Xieng Khouang because of anti-Capellan prejudice prompt the ransacking of the station in what becomes known as the Xieng Khouang Massacre. Thirty-eight ComStar staff and dependents are lynched in the streets before order is restored.,,,,,,,
Dark Age - Shattered Fortress,100,3148,9,,,,,"Several independent worlds located between the FWL and the Magistracy of Canopus—Payvand, Obrenovac, Rohinjan, Saonara, Rushegg, and Ayn Tarma—join the Magistracy.",,,,,,,
Dark Age - Shattered Fortress,101,3149,9,,3149,11,,"Two more worlds fall to PERCEVAL, but the DCMS retakes Coloma.",,,,,,,
Dark Age - Shattered Fortress,100,3149,9,,,,,"A Clan Wolf fleet arrives at Denebola and discovers evidence of a massive naval fleet near the system’s fringe. A few months later, the Watch discovers the ""flotilla"" is actually a large-scale deception.",,,,,,,
Dark Age - Shattered Fortress,101,3150,9,,,,,"The Timbuktu Collective annexes Pocologan and Viborg, offering better protection from predation.",,,,,,,
Era Report 3062,26,3058,10,1,,,,"Whitting Conference begins on Tharkad. In a surprising move, the leaders of the Inner Sphere agree to reform the Star League and take the war to the Clans.",,,,,,,
Field Manual - Update,7,3058,10,1,,,,"The first Whitting Conference opens on Tharkad, leading to the reformation of the Star League and the decision to target Clan Smoke Jaguar for Annihilation",,,,,,,
Historical - Fedcom Civil War,15,3058,10,1,,,,"The first Whitting Conference opens on Tharkad, leading to the reformation of the Star League and the decision to target Clan Smoke Jaguar for Annihilation",,,,,,,
House Book House Davion,83,3058,10,1,,,,First Whitting Conference begins.,,,,,,,
"Sourcebook - The Clans, Warriors of Kerensky",32,3058,10,1,3058,11,21,Delegates at the Whitting Conference agree to form a new Star League and take the war to the Clans.,,,,,,,
Jihad Plot Sourcebook - Final Reckoning,46,3069,10,1,3069,10,7,"Clan Wolf seizes La Grave, Domain, Orkney, Jabuka and Rasalgethi, shadowing the Falcon advances.",,,,,,,
Jihad Plot Sourcebook - Jihad Hot Spots - 3072,18,3069,10,1,3069,10,7,"Clan Wolf seizes La Grave, Domain, Orkney, Jabuka and Rasalgethi, shadowing the Falcon advances.",,,,,,,
Era Report 3145,19,3135,10,1,,,,Exarch Levin announces formation of Fortress Republic.,,,,,,,
Field Manual - 3145,23,3135,10,1,,,,Exarch Levin announces formation of Fortress Republic.,,,,,,,
Historical - Wars of the Republic Era,16,3135,10,1,,,,Levin enacts the Fortress Republic protocol.,,,,,,,
Era Report 3052,16,3050,10,2,,,,Clan smoke Jaguar is defeated on Wolcott and as a result they swear never to invade the world again.,,,,,,,
"Sourcebook - The Clans, Warriors of Kerensky",32,3050,10,2,,,,DCMS troops hold Wolcott against Clan Smoke Jaguar.,,,,,,,
Jihad Plot Sourcebook - Final Reckoning,49,3071,10,2,,,,"The Screaming Eagles mercenary command launches an unsanctioned attack the Outworlds Alliance world of Ramora, engaging Outworlds and Snow Raven forces.",,,,,,,
Jihad Plot Sourcebook - Jihad Hot Spots - 3076,16,3071,10,2,,,,"The Screaming Eagles mercenary command launches an unsanctioned attack on the Outworlds Alliance world of Ramora, engaging Outworlds and Snow Raven forces.",,,,,,,
Jihad Plot Sourcebook - Final Reckoning,55,3076,10,2,,,,"The FCS New Syrtis arrives at Brusett to break the Taurian siege there. In the ensuing naval battle, a nuclear strike cripples the Davion ship, but not before her pocket Warship escorts can inflict critical damage to the Vendetta and force her to retreat.",,,,,,,
Jihad Plot Sourcebook - Jihad Hot Spots - Terra,21,3076,10,2,,,,"The FSS New Syrtis arrives at Brusett to break the Taurian siege there. In the ensuing naval battle, a nuclear strike cripples the Davion ship, but not before her pocket Warship escorts can inflict critical damage to the Vendetta and force her to retreat.",,,,,,,
Jihad Plot Sourcebook - Final Reckoning,58,3078,10,2,,,,"At Budapest, Word of Blake and TerraSec forces manage to throw back superior Coalition numbers. At the same time, a Moscow raid by additional TerraSec security troops manages to penetrate the ancient city, but is annihilated by the allied forces holding the area.",,,,,,,
Jihad Plot Sourcebook - Blake Ascending,177,3068,10,3,,,,"The unexpected recall of both Knights of the Inner Sphere regiments to Atreus weakens the central thrust of Marshall Brett’s counter-invasion of the Lyran Alliance. Capellan March troops seize Housekarle, No Return and Randar as Duke Hasek rushes to resupply troops poised near Sian.",,,,,,,
Jihad Plot Sourcebook - Final Reckoning,45,3068,10,3,,,,"The unexpected recall of both Knights of the Inner Sphere regiments to Atreus weakens the central thrust of Marshall Brett’s counter-invasion of the Lyran Alliance. Capellan March troops seize Housekarle, No Return and Randar as Duke Hasek rushes to resupply troops poised near at Sian.",,,,,,,
Jihad Plot Sourcebook - Jihad Hot Spots - 3072,9,3068,10,3,,,,"The surprise recall of both Knights of the Inner Sphere regiments to Atreus weakens Marshall Brett’s counter-invasion of the Lyran Alliance. Capellan March troops seize Housekarle, No Return and Randar as Duke Hasek rushes to resupply troops poised near Sian.",,,,,,,
Jihad Plot Sourcebook - Final Reckoning,58,3078,10,3,,,,"Allied forces manage to capture the Krupp Armaments facilities outside Budapest, forcing the Word to immediately surrounding the area.",,,,,,,
Era Digest: Dark Age,10,3131,10,3,,,,Bank collapse on Vega.,,,,,,,
Dark Age - Shattered Fortress,99,3146,10,3,,,,"The Combine plants their flag on New Avalon. With Robinson and New Syrtis also occupied, the AFFS High Command withdraws to June, the last March capital.",,,,,,,
