,,Start or Timeframe,,,End,,,,,,,,This1,This2,This3
25 Years of Art & Fiction,21,2528,,,,,,TC and CC fight Ariana’s War,,,,,,,
Era Digest: Age of War,7,2528,,,2531,,,Second Andurien War,,,,,,,
Handbook House Liao,24,2528,,,,,,"Kalvin Liao invades Andurien to win the heart of Mesillia Allard, beginning the Second Andurien War.",,,,,,,
Handbook House Marik,25,2528,,,,,,The Second Andurien War breaks out between the Free Worlds League and the Capellan Confederation.,,,,,,,
House Book House Davion,37,2528,,,,,,"Alexander Davion makes great progress within the Crucis March, forcing Laura Davion to retreat into the Draconis March.",,,,,,,
25 Years of Art & Fiction,21,2530,,,,,,Kossandra Centrella founds the Magistracy of Canopus,,,,,,,
Era Digest: Age of War,7,2530,,,,,,The Magistracy of Canopus forms,,,,,,,
Handbook House Liao,24,2530,,,,,,Kalvin Liao assassinated.,,,,,,,
Handbook House Marik,25,2530,,,,,,The Magistracy of Canopus forms.,,,,,,,
House Book House Davion,37,2530,,,,,,"Magistracy of Canopus formed. After more than a year-and-a-half lull, the Davion Civil War reerupts as Alexander Davion focuses on the Draconis March while dispatching General John Gordon to tie up Varnay forces in the Capellan March. David Varnay dies in a riot on the world of Ashley.",,,,,,,
25 Years of Art & Fiction,21,2531,,,,,,Constitution of Magistracy Free States established,,,,,,,
25 Years of Art & Fiction,21,2531,,,,,,Second Andurien War ends,,,,,,,
Handbook House Marik,25,2531,,,,,,"The Free Worlds League attempts to recapture Megrez from the Lyrans. The Terran Hegemony steps in to mediate the dispute, as well as the ongoing con?ict with the Capellan Confederation.",,,,,,,
House Book House Davion,37,2536,,,,,,"After two years of slow but steady advance, Varnay forces take a large swath of worlds in the Crucis March, concluding with El Dorado.",,,,,,,
25 Years of Art & Fiction,21,2537,,,,,,Davion Civil War ends,,,,,,,
25 Years of Art & Fiction,21,2537,,,,,,FS Principalities disbanded,,,,,,,
House Book House Davion,37,2537,,,,,,"Alexander Davion and Dmitri Rostov meet on Belladonna; the two launch a two-pronged assault on Cassandra Varnay’s forces. Battle of Victoria breaks the back of the Varnay forces; Cassandra Varnay and her son, Roger, ?ee to the Capellan Confederation. Alexander Davion assumes the First Principality on New Avalon.",,,,,,,
Era Digest: Age of War,7,2540,,,,,,United Hindu Collective joins Federated Suns,,,,,,,
House Book House Davion,37,2540,,,,,,"Dmitri Rostov, Prince of the Terran March, mobilizes his forces in defance of Alexander Davion; Rostov’s forces attempt to kidnap Cynthia Davion, but accidentally kill her; Davion responds by declaring war on Rostov.",,,,,,,
House Book House Davion,37,2541,,,,,,"First Prince Alexander Davion begins sweeping reforms of the Federated Suns, including the abolition of the Terran and Outer Marches as well as the regional princes; the First Prince would now be the supreme power within the Federated Suns; Armed Forces of the Federated Suns formed.",,,,,,,
25 Years of Art & Fiction,21,2543,,,,,,Supreme Court of Lyran Commonwealth created,,,,,,,
25 Years of Art & Fiction,21,2546,,,,,,FS and CC sign Bell Accord,,,,,,,
Handbook House Liao,24,2546,,,,,,"The Confederation and the Federated Suns sign Bell Accords, in which both sides agree to disallow the use of nuclear weapons (aside from the provisions of the Ares Conventions, which could be waived).",,,,,,,
25 Years of Art & Fiction,21,2549,,,,,,TH September Revolt,,,,,,,
25 Years of Art & Fiction,21,2550,,,,,,Sarna Mandate developed,,,,,,,
Era Digest: Age of War,11,2550,,,,,,Firestarter (LC) introduced,,,,,,,
25 Years of Art & Fiction,21,2551,,,,,,Third Andurien War begins,,,,,,,
Era Digest: Age of War,7,2551,,,,,,Third Andurien War,,,,,,,
25 Years of Art & Fiction,21,2556,,,,,,Age of War ends,,,,,,,
25 Years of Art & Fiction,21,2556,,,,,,CC joins Terran League,,,,,,,
25 Years of Art & Fiction,21,2556,,,,,,"TH, CC and FWL sign Treaty of Geneva",,,,,,,
25 Years of Art & Fiction,21,2556,,,,,,Third Andurien War ends,,,,,,,
Era Digest: Age of War,7,2556,,,,,,"Terran Hegemony, Capellan Confederation, and Free Worlds League sign a secret trade and mutual defense pact, laying the foundation for the Star League",,,,,,,
Handbook House Liao,24,2556,,,,,,Terrence Liao signs Star League Articles; the Confederation joins the Star League.,,,,,,,
Handbook House Marik,25,2556,,,,,,"The Terran Hegemony successfully mediates an end to the Third Andurien War. With the aid of Albert Marik, Ian Cameron persuades House Liao to sign up for Cameron’s Star League concept.",,,,,,,
Historical - Liberation of Terra II,15,2556,,,,,,Age of War ends thanks to Terran peacemaking efforts,,,,,,,
25 Years of Art & Fiction,21,2558,,,,,,LC agrees to join the Star League,,,,,,,
25 Years of Art & Fiction,21,2558,,,,,,Tharkan Accords signed,,,,,,,
Era Digest: Age of War,7,2558,,,,,,Lyran Commonwealth joins the forming Star League,,,,,,,
Handbook House Marik,25,2558,,,,,,The Tharkan Accords signify the Lyran Commonwealth’s intention to become part of the embryonic Star League.,,,,,,,
Era Digest: Age of War,7,2560,,,,,,Draconis Combine establishes prison colony on Mica,,,,,,,
Era Digest: Age of War,11,2561,,,,,,Catapult (TH) introduced,,,,,,,
Era Digest: Age of War,11,2564,,,,,,Xanthos (CC) introduced,,,,,,,
House Book House Davion,49,2565,,,,,,Roger Varnay returns to the Federated Suns and attempts to incite rebellion within the Capellan March; Alexander Davion’s forces quickly destroy Varnay’s forces and put down the rebellion; Varnay again escapes to the Confederation.,,,,,,,
25 Years of Art & Fiction,21,2566,,,,,,FWL instigates economic crisis in FS,,,,,,,
House Book House Davion,49,2566,,,,,,"Economic crisis erupts within the Suns, fueled by Free Worlds League meddling.",,,,,,,
25 Years of Art & Fiction,21,2567,,,,,,FS agrees to join the Star League,,,,,,,
25 Years of Art & Fiction,21,2567,,,,,,New Avalon Accords signed,,,,,,,
Era Digest: Age of War,11,2567,,,,,,Double heat sinks perfected,,,,,,,
Handbook House Marik,25,2567,,,,,,The New Avalon Accords bind the Federated Suns into the Star League.,,,,,,,
Era Digest: Age of War,11,2568,,,,,,Phoenix Hawk (TH) introduced,,,,,,,
25 Years of Art & Fiction,21,2569,,,,,,DC agrees to join the Star League,,,,,,,
25 Years of Art & Fiction,21,2569,,,,,,Treaty of Vega signed,,,,,,,
Era Digest: Age of War,11,2570,,,,,,Galahad (TH) and Scorpion (TH) introduced,,,,,,,
25 Years of Art & Fiction,21,2571,,,,,,Ian Cameron named First Lord of the Star League,,,,,,,
25 Years of Art & Fiction,21,2571,,,,,,Shandra Noruff-Cameron appointed Commanderin-Chief of Star League Defense Force,,,,,,,
25 Years of Art & Fiction,21,2571,,,,,,Star League Accords signed,,,,,,,
25 Years of Art & Fiction,21,2571,,,,,,Star League formed,,,,,,,
Era Digest: Age of War,7,2571,,,,,,Age of War ends with the formal creation of the Star League,,,,,,,
Historical - Liberation of Terra I,30,2571,,,,,,Star League Accords signed. Ursula Liao becomes Chancellor of Capellan Confederation. Shandra Noruff-Cameron appointed Commander-In-Chief of Star League Defense Force. Ian Cameron named First Lord of the Star League.,,,,,,,
Historical - Liberation of Terra I,30,2571,,,2597,,,Early Star League,,,,,,,
Historical - Liberation of Terra II,15,2571,,,,,,Star League formed by Ian Cameron and Albert Marik,,,,,,,
House Book - Star League,105,2571,,,2575,,,General Shandra Noruff-Cameron in charge of Star League Defense Forces.,,,,,,,
25 Years of Art & Fiction,21,2572,,,,,,Border Guards Agreement passed,,,,,,,
25 Years of Art & Fiction,21,2572,,,,,,Executive Order 4 issued,,,,,,,
25 Years of Art & Fiction,21,2572,,,,,,Santiago Massacre,,,,,,,
25 Years of Art & Fiction,21,2572,,,,,,Star League Directive 21 instituted,,,,,,,
25 Years of Art & Fiction,21,2572,,,,,,United Triumph Military Exercises take place,,,,,,,
Historical - Liberation of Terra I,30,2572,,,,,,Star League Directive 21 instituted. Santiago Massacre. United Triumph Military Exercises take place. Border Guards Agreement passed.,,,,,,,
House Book House Davion,49,2572,,,,,,"First Lord Ian Cameron invites the four Periphery nations to join the Star League; all four refuse, angering Cameron.",,,,,,,
25 Years of Art & Fiction,21,2573,,,,,,Bureau of Star League Affairs created,,,,,,,
25 Years of Art & Fiction,21,2573,,,,,,Malagrotta Affair,,,,,,,
25 Years of Art & Fiction,21,2573,,,,,,RWR Universal Act of Loyalty passed,,,,,,,
Era Digest: Age of War,11,2573,,,,,,Alfar (LC) introduced,,,,,,,
Historical - Liberation of Terra I,30,2573,,,,,,Malagrotta Affair. Rim Worlds Universal Act of Loyalty passed. Bureau of Star League Affairs created.,,,,,,,
25 Years of Art & Fiction,21,2574,,,,,,Harsh Periphery trade laws and taxes passed,,,,,,,
Historical - Liberation of Terra I,30,2574,,,,,,Harsh Periphery trade restrictions and taxes passed.,,,,,,,
25 Years of Art & Fiction,21,2575,,,,,,LC Tax Reform Debate of 2575,,,,,,,
25 Years of Art & Fiction,21,2575,,,,,,Pollux Proclamation issued,,,,,,,
25 Years of Art & Fiction,21,2575,,,,,,Reunification War begins,,,,,,,
25 Years of Art & Fiction,21,2575,,,,,,RWR Manchester Directive issued,,,,,,,
25 Years of Art & Fiction,21,2575,,,,,,Taurian Campaign begins,,,,,,,
Handbook House Marik,25,2575,,,,,,"The Star League issues the Pollux Proclamation, demanding that the Periphery states join the League. The Periphery states refuse, triggering the Reunifcation War.",,,,,,,
Historical - Liberation of Terra I,30,2575,,,,,,Pollux Proclamation issued. Manchester Directive issued In Rim Worlds Republic. Taurian Campaign begins. Shandra Noruff-Cameron steps down and is succeeded by Carlos Dangmar Lee.,,,,,,,
House Book - Star League,105,2575,,,2597,,,General Dangmar Lee in charge of Star League Defense Forces.,,,,,,,
25 Years of Art & Fiction,21,2576,,,,,,Case Amber adopted,,,,,,,
Historical - Liberation of Terra I,30,2576,,,,,,Case Amber enacted.,,,,,,,
25 Years of Art & Fiction,21,2577,,,,,,Canopian Campaign begins,,,,,,,
Era Digest: Age of War,7,2577,,,2597,,,Reunification War,,,,,,,
Handbook House Liao,24,2577,,,,,,Reunifcation War begins as the Star League uses military force to annex the Periphery states.,,,,,,,
Handbook House Marik,25,2577,,,,,,"The Taurian Concordat launches a preemptive strike, code-named Case Amber, against Star League forces gathering to attack the Concordat. The assault destroys twenty Davion auxiliary ships on 15 March. The Reunifcation War officially starts when the Star League declares war on the Periphery states. [June] Captain-General Marion Marik leads the SLDF Seventh Corps against the Magistracy of Canopus.",,,,,,,
Historical - Liberation of Terra I,30,2577,,,,,,Canopian Campaign begins.,,,,,,,
Historical - Liberation of Terra II,15,2577,,,,,,Official commencement of the Reunification War,,,,,,,
25 Years of Art & Fiction,21,2578,,,,,,Star League officially declares war,,,,,,,
Handbook House Marik,25,2578,,,,,,Magistracy forces strike at the Star League transport/supply nexus on Meadowvale. This action halts the League advance for six months.,,,,,,,
Historical - Liberation of Terra I,30,2578,,,,,,Star League officially declares war on the Periphery states.,,,,,,,
House Book House Davion,49,2578,,,,,,"Star League officially declares war on the Periphery, intending to forcibly integrate those nations into the Star League.",,,,,,,
25 Years of Art & Fiction,21,2579,,,,,,Star League renounces tenets of Ares Conventions,,,,,,,
Handbook House Marik,25,2579,,,,,,Ian Cameron renounces the Ares Conventions for the duration of the Reunifcation War. Marion Marik refuses to follow suit.,,,,,,,
Historical - Liberation of Terra I,30,2579,,,,,,Ian Cameron renounces tenets of Ares Conventions.,,,,,,,
25 Years of Art & Fiction,21,2581,,,,,,LC Operation Mailed Fist launched,,,,,,,
25 Years of Art & Fiction,21,2581,,,,,,OA Consadine Mission launched,,,,,,,
25 Years of Art & Fiction,21,2581,,,,,,Outworlds Campaign begins,,,,,,,
25 Years of Art & Fiction,21,2581,,,,,,Rim Worlds Campaign begins,,,,,,,
25 Years of Art & Fiction,21,2581,,,,,,Star League forces orbitally bombard Robsart,,,,,,,
Historical - Liberation of Terra I,30,2581,,,,,,Operation Mailed Fist launched. Outworlds Campaign begins. Pitcairn Legion formed. Rim Worlds Campaign begins.,,,,,,,
House Book House Davion,49,2581,,,,,,Beginning of Rim Worlds campaign.,,,,,,,
25 Years of Art & Fiction,21,2582,,,,,,Shippers License Act passed,,,,,,,
25 Years of Art & Fiction,21,2583,,,,,,TC Case Black enacted,,,,,,,
Handbook House Marik,25,2583,,,,,,The Canopian Navy is ambushed and destroyed at Thurrock.,,,,,,,
Historical - Liberation of Terra I,30,2583,,,,,,Case Black enacted. Amalthia Kincaid assassinated.,,,,,,,
25 Years of Art & Fiction,21,2584,,,,,,Freebooters War begins,,,,,,,
25 Years of Art & Fiction,21,2584,,,,,,FWL captures Canopus IV,,,,,,,
Handbook House Liao,24,2584,,,2588,,,Freebooters’ War rages across Capellan and Free Worlds space as rogue soldiers enact a pirate reign of terror. Their eventual capture by a joint Capellan-Free Worlds task force marks the only time before the 3050s that the two realms cooperate militarily.,,,,,,,
Historical - Liberation of Terra I,30,2584,,,,,,Free Worlds League captures Canopus IV. Freebooters War begins.,,,,,,,
25 Years of Art & Fiction,22,2585,,,,,,OA Peace of Cerberus negotiated,,,,,,,
25 Years of Art & Fiction,22,2585,,,,,,Outworlds Campaign ends,,,,,,,
Historical - Liberation of Terra I,30,2585,,,,,,Peace of Cerberus negotiated. Outworlds Campaign ends.,,,,,,,
House Book House Davion,49,2585,,,,,,End of Outworlds campaign.,,,,,,,
Era Report 2750,13,2587,,,,,,"During summer. SLEF unleashes bioweapons on Landmark, killing millions.",,,,,,,
Historical - Liberation of Terra I,30,2587,,,,,,Grigori Avellar dies. Barton Avellar named Outworlds Parliamentary President.,,,,,,,
25 Years of Art & Fiction,22,2588,,,,,,Canopian Campaign ends,,,,,,,
25 Years of Art & Fiction,22,2588,,,,,,Freebooters War ends,,,,,,,
25 Years of Art & Fiction,22,2588,,,,,,FWL gains control of Magistracy of Canopus,,,,,,,
Handbook House Marik,25,2588,,,,,,The remaining Magistracy worlds fall to Star League forces. The Freebooters’ War ends with a joint FWLM-CCAF assault on Wisconsin.,,,,,,,
Historical - Liberation of Terra I,30,2588,,,,,,Free Worlds League gains control of Magistracy of Canopus. Freebooters War ends. Marantha Calderon becomes Protector of the Taurian Homeworlds. Melissa Humphreys appointed Military Governor of Magistracy. Canopian Campaign ends.,,,,,,,
House Book House Davion,49,2588,,,,,,End of Magistracy campaign.,,,,,,,
Historical - Liberation of Terra I,30,2591,,,,,,Hehiro Kurita dies. Leonard Kurita named Coordinator of Draconis Combine. Kevin Steinerdinesen kidnapped.,,,,,,,
25 Years of Art & Fiction,22,2592,,,,,,LC Estates-General disbanded,,,,,,,
Historical - Liberation of Terra I,30,2592,,,,,,Kevin Steiner-Dinesen rescued. Lyran Estatesgeneral disbanded.,,,,,,,
25 Years of Art & Fiction,22,2596,,,,,,Rim Provisional Government surrenders,,,,,,,
25 Years of Art & Fiction,22,2596,,,,,,Rim Worlds Campaign ends,,,,,,,
25 Years of Art & Fiction,22,2596,,,,,,Taurian Campaign ends,,,,,,,
25 Years of Art & Fiction,22,2596,,,,,,TC surrenders,,,,,,,
Historical - Liberation of Terra I,30,2596,,,,,,Viola Steiner-Dinesen killed. Kevin Steiner-Dinesen named Archon. Taurians surrender. Marantha Calderon commits suicide. Henry Calderon named Protector of the Taurian Homeworlds. Rim Provisional Government surrenders. Taurian Campaign ends. Rim Worlds Campaign ends.,,,,,,,
House Book House Davion,49,2596,,,,,,Prince Alexander’s sons Vincent and Roger Davion declared dead after their Jumpship disappears.,,,,,,,
25 Years of Art & Fiction,22,2597,,,,,,Reunification War ends,,,,,,,
25 Years of Art & Fiction,22,2597,,,,,,"TC, MC, RWR and OA become Territorial States of the Star League",,,,,,,
Handbook House Liao,24,2597,,,,,,"Ursula Liao decrees ""cattle tax"" that exacts payment from Star League soldiers transiting through the Confederation en route to Periphery space, even as the Reunifcation War draws to a close after twenty years of con?ict.",,,,,,,
Handbook House Marik,25,2597,,,,,,The Reunifcation War ends.,,,,,,,
Historical - Liberation of Terra I,30,2597,,,,,,"Reunification War ends. Taurian Concordat, Magistracy of Canopus, Rim Worlds Republic and Outworlds Alliance become Territorial States of the Star League.",,,,,,,
Historical - Liberation of Terra II,15,2597,,,,,,Reunification War ends,,,,,,,
House Book House Davion,49,2597,,,,,,The four Periphery nations become Territorial States of the Star League.,,,,,,,
25 Years of Art & Fiction,22,2598,,,,,,Capellan Decree of Succession issued,,,,,,,
Historical - Liberation of Terra I,30,2598,,,,,,Capellan Decree of Succession Issued. General Nicholas Kinnol named Commander-In-Chief of SLDF.,,,,,,,
Historical - Liberation of Terra I,30,2598,,,2750,,,Star League Golden Age,,,,,,,
House Book - Star League,105,2598,,,2646,,,General Nicholas Kinnol in charge of Star League Defense Forces.,,,,,,,
Historical - Liberation of Terra I,30,2599,,,,,,Normann Aris becomes Chancellor of Capellan Confederation. Gregory Amaris assassinated. Richard Amaris becomes President of Rim Worlds Republic.,,,,,,,
House Book House Davion,49,2599,,,,,,Prince Alexander’s grandson Ian Davion assassinated.,,,,,,,
25 Years of Art & Fiction,22,2600,,,,,,Good Years begin,,,,,,,
Historical - Liberation of Terra I,30,2600,,,,,,Shandra Noruff-Cameron dies. Good Years begin.,,,,,,,
Historical - Liberation of Terra I,30,2602,,,,,,Ian Cameron dies. Nicholas Cameron named First Lord.,,,,,,,
25 Years of Art & Fiction,22,2604,,,,,,Civil government on Canopus restored,,,,,,,
25 Years of Art & Fiction,22,2604,,,,,,"Kerensky family named ""Defenders of the First Lord""",,,,,,,
Handbook House Marik,25,2604,,,,,,"The military occupation of the Magistracy of Canopus ends. Tanya Kerensky, an SLDF trooper, dies from stab wounds in?icted by Leonard Kurita during a struggle in the Star League Council Chambers.",,,,,,,
Historical - Liberation of Terra I,30,2604,,,,,,Kerensky family named Defenders of the First Lord after the murder of Tanya Kerensky while defending the First Lord.,,,,,,,
House Book House Davion,49,2604,,,,,,"Years of unrest, grumblings, and occasional minor rebellions due to economic problems begin.",,,,,,,
25 Years of Art & Fiction,22,2605,,,,,,Last Star League forces leave TC,,,,,,,
25 Years of Art & Fiction,22,2606,,,,,,Executive Order 34 issued,,,,,,,
Handbook House Liao,24,2606,,,2610,,,"Confederation economy collapses as Reunifcation War ends. Chancellor Normann Aris begins restructuring Capellan society based on the Korvin Doctrine, which allows for the redirection of labor based on the needs of the state rather than the individual.",,,,,,,
Historical - Liberation of Terra I,30,2606,,,,,,Executive order 34 issued.,,,,,,,
25 Years of Art & Fiction,22,2607,,,,,,Last Star League forces leave OA,,,,,,,
25 Years of Art & Fiction,22,2607,,,,,,Territorial States given Associate-Member status,,,,,,,
Handbook House Marik,25,2607,,,,,,The last Star League troops withdraw from the Periphery.,,,,,,,
Historical - Liberation of Terra I,30,2607,,,,,,Territorial states given Associate-Member status.,,,,,,,
25 Years of Art & Fiction,22,2611,,,,,,LC Estates-General reconvened,,,,,,,
Handbook House Liao,24,2611,,,,,,Normann Aris dies in a hunting accident on Nanking.,,,,,,,
25 Years of Art & Fiction,22,2617,,,,,,DC capital moved to Luthien,,,,,,,
House Book House Davion,49,2617,,,,,,Last of the Varnay uprisings; AFFS forces destroy Josip Varnay’s rebellion; Josip Varnay ?ees but the Confederation expels the Varnay family.,,,,,,,
25 Years of Art & Fiction,22,2623,,,,,,LC Businessman’s Strike of 2623,,,,,,,
25 Years of Art & Fiction,22,2623,,,,,,Star League system of currency adopted,,,,,,,
Historical - Liberation of Terra I,30,2623,,,,,,New Star League currency system adopted.,,,,,,,
Historical - Liberation of Terra I,30,2629,,,,,,First Hyperpulse Generator built.,,,,,,,
25 Years of Art & Fiction,22,2630,,,,,,First HPG message transmitted,,,,,,,
Handbook House Marik,25,2630,,,,,,"Hyperpulse generators, a Marik invention, undergo their frst tests.",,,,,,,
Historical - Liberation of Terra II,15,2630,,,,,,First use of the Hyperpulse Generator (HPG) allows faster-than-light communication.,,,,,,,
Historical - Liberation of Terra I,30,2631,,,,,,Executive order 35 issued.,,,,,,,
Era Report 2750,14,2632,,,,,,During springtime. Era of Rapid Expansion and Colonization begins.,,,,,,,
25 Years of Art & Fiction,22,2640,,,,,,First Martial Olympiad,,,,,,,
Handbook House Marik,25,2640,,,,,,The SLDF holds the frst Martial Olympiad.,,,,,,,
Historical - Liberation of Terra I,30,2640,,,,,,First Martial Olympiad.,,,,,,,
House Book - Star League,135,2640,,,,,,"Martial Olympiad on Mars. 316th Royal BattleMech Division (Rio Grande Division) best division, 90th Dragoon Regiment best regiment, and SLS Ark Royal best Warship.",,,,,,,
House Book - Star League,135,2644,,,,,,"Martial Olympiad on Mars. 225th BattleMech Division (Battle of Moscow Division) best division, 228th Striker Regiment best regiment, and SLS Michigan best Warship.",,,,,,,
Historical - Liberation of Terra I,30,2646,,,,,,General Killian Squarn-Turk named Commanding General of SLDF.,,,,,,,
House Book - Star League,106,2646,,,2680,,,General Killian Squarn-Turk in charge of Star League Defense Forces.,,,,,,,
House Book - Star League,135,2648,,,,,,"Martial Olympiad on Mars. 83rd BattleMech Division (Balan Division) best division, 90th Dragoon Regiment best regiment, and SLS Israel best Warship.",,,,,,,
Historical - Liberation of Terra I,30,2649,,,,,,Nicholas Cameron dies. Michael Cameron named First Lord.,,,,,,,
25 Years of Art & Fiction,22,2650,,,,,,Good Years end,,,,,,,
Handbook House Liao,24,2650,,,,,,"At the suggestion of Chancellor Warex Liao, the Star League Council passes a resolution allowing Member State militaries to double in size.",,,,,,,
Handbook House Marik,25,2650,,,,,,"Michael Cameron issues the Edict of 2650 limiting the size of each member-state’s military. Heavy cuts in the DCMS result, leaving many Combine MechWarriors ronin (masterless warriors).",,,,,,,
Handbook House Marik,31,2650,,,,,,"First Lord’s Edict of 2650 issued, limiting the size of Star League member-state militaries and private troops.",,,,,,,
Handbook House Steiner,31,2650,,,,,,"Council Edict of 2650 issued, limiting the size of member-state militaries and private troops.",,,,,,,
Historical - Liberation of Terra I,30,2650,,,,,,Good Years end. Council Edict 2650 Issued.,,,,,,,
House Book House Davion,49,2650,,,,,,"Council Edict 2650 issued, limiting the size of House and private armies.",,,,,,,
25 Years of Art & Fiction,22,2651,,,,,,Star League levies new taxes against territorial states,,,,,,,
Handbook House Steiner,31,2651,,,,,,"Star League levies new taxes against Territorial States to support military expansion, part of which included the formation of Regimental Combat Teams.",,,,,,,
25 Years of Art & Fiction,22,2652,,,,,,DC industrial development program initiated,,,,,,,
House Book - Star League,135,2652,,,,,,"Martial Olympiad on Mars. 316th Royal BattleMech Division (Rio Grande Division) best division, 302nd Hussar Regiment best regiment, and SLS Ukraine best Warship.",,,,,,,
House Book - Star League,135,2656,,,,,,"Martial Olympiad on Mars. 50th Royal Infantry Division (Flame Keepers of Greece) best division, 228th Striker Regiment best regiment, and SLS Richelieu best Warship.",,,,,,,
House Book House Davion,49,2659,,,,,,Zane Davion dies and is succeeded by his daughter Sarah Davion.,,,,,,,
25 Years of Art & Fiction,22,2660,,,,,,LC rescinds foreign tariffs,,,,,,,
House Book - Star League,135,2660,,,,,,"Martial Olympiad on Mars. 225th BattleMech Division (Battle of Moscow Division) best division, 309th Heavy Assault Regiment best regiment, and SLS Hiryu best Warship.",,,,,,,
Handbook House Steiner,31,2663,,,,,,"Consuelo Calderon named ""Second Lord"" (honorary co-chairperson of the Star League Council), marking the apex of Star League relations with the Territorial States as the frst and only time a Periphery ruler would achieve such a high station.",,,,,,,
House Book - Star League,135,2664,,,,,,"Martial Olympiad on Mars. 13th Royal Infantry Division (Superstition Division) best division, 13th Royal French Demi-Brigade best regiment, and SLS Yorktown best Warship.",,,,,,,
25 Years of Art & Fiction,22,2667,,,,,,Scourge of Death makes first appearance in FWL,,,,,,,
Handbook House Marik,31,2667,,,,,,Scourge of Death anti-League terrorists surface in Free Worlds League.,,,,,,,
Handbook House Steiner,31,2667,,,,,,Scourge of Death anti-League terrorists surface in Free Worlds League.,,,,,,,
House Book - Star League,135,2668,,,,,,"Martial Olympiad on Mars. 181st Royal Mechanized Infantry Division (King's Own Scots Rifles) best division, 512th Striker Regiment best regiment, and SLS lona best Warship.",,,,,,,
Handbook House Steiner,31,2672,,,,,,"Archon Sarah Steiner-Dinesen abdicates in favor of her son, William Steiner.",,,,,,,
House Book - Star League,135,2672,,,,,,"Martial Olympiad on Mars. 316th Royal BattleMech Division (Rio Grande Division) best division, 90th Dragoon Regiment best regiment, and SLS Cyclone best Warship.",,,,,,,
25 Years of Art & Fiction,22,2676,,,,,,House units allowed to compete in Martial Olympiads,,,,,,,
Handbook House Marik,31,2676,,,,,,House units frst allowed to compete in SLDF Martial Olympiad.,,,,,,,
Handbook House Steiner,31,2676,,,,,,House units frst allowed to compete in SLDF Martial Olympiad.,,,,,,,
Historical - Liberation of Terra I,30,2676,,,,,,House Units allowed to compete in Martial Olympiads.,,,,,,,
